<?xml version="1.0" encoding="UTF-8"?>
<!DOCTYPE Rules SYSTEM "../rules.dtd">

    <Unit id="light_cavalry" category="unitcategory_cavalry">
      <Name>Ostrich Rider</Name>
      <Name lang="de_DE">Straußenreiter</Name>
      <Description lang="de_DE">
        <p>Der Straßenreiter ist die einfachste Berittene Einheit.</p> 
      </Description>
      <Description lang="en_US">
        <p>Ostritch riders are the simplest type of cavalry units.</p>
      </Description>
      <Flavour lang="en_US">
        <p>Ostritch riders are fast, that's it. This is why the riders have to focus all their concentration on controlling their mount.'</p>
      </Flavour>
      <Flavour lang="de_DE">
        <p>Straußenreiter sind schnell, sonst nichts. Deshalb müssen die Reiter ihre ganze Konzentration auf das Führen ihres Reittieres legen.</p>
      </Flavour>
      <Cost id="resource_stone" round="true">60</Cost>
      <Cost id="resource_wood" round="true">40</Cost>
      <Cost id="resource_fur" round="true">150</Cost>
      <ProductionTime shortenable="true">800</ProductionTime>
      <Velocity>1.2</Velocity>
      <ActionPoints>4</ActionPoints>
      <Initiative>26</Initiative>
      <Attack>6</Attack>
      <CriticalDamage chance="0.02">1</CriticalDamage>
      <Armor>5</Armor>
      <Overrunnable>true</Overrunnable>
      <Hitpoints>90</Hitpoints>
      <Effectiveness category="unitcategory_infantry">0.75</Effectiveness>
      <Effectiveness category="unitcategory_cavalry">1</Effectiveness>
      <Effectiveness category="unitcategory_artillery">1.5</Effectiveness>
      <Effectiveness category="unitcategory_siege">0.8</Effectiveness>   
      <Effectiveness category="unitcategory_special">1</Effectiveness>
      <RequirementGroup>
        <Requirement id="building_cavalry_tower" min_level="1" />
      </RequirementGroup>
      <RequirementGroup>
        <Requirement id="building_stud" min_level="1" />
      </RequirementGroup>
      <RequirementGroup>
          <Requirement id="building_stud_2" min_level="1" />
      </RequirementGroup>
    </Unit>
