<?xml version="1.0" encoding="UTF-8"?>
<!DOCTYPE Rules SYSTEM "../rules.dtd">

<Unit id="clubbers" category="unitcategory_infantry">
  <Name>Club Warrior</Name>
  <Name lang="de_DE">Keulenkrieger</Name>
  
  <Description lang="de_DE">
    <p>Die Keulenkrieger sind die ersten ernstzunehmenden Nahk√§mpfer.</p>		
  </Description>
  <Description lang="en_US">
    <p>Clubbers are the first type of melee unit to be reckoned with.</p>
  </Description>
  <Flavour lang="en_US">
    <p>Wields a club and is always at the front of the battle lines.</p>
  </Flavour>
  <Flavour lang="de_DE">
    <p>Eine Keule in der Hand und immer an vorderster Front.</p>
  </Flavour>
  <Cost id="resource_stone" round="true">20</Cost>
  <Cost id="resource_wood" round="true">30</Cost>    
  <Cost id="resource_fur" round="true">75</Cost>
  <ProductionTime shortenable="true">600</ProductionTime>
  <Velocity>1</Velocity>
  <ActionPoints>4</ActionPoints>
  <Initiative>16</Initiative>
  <Attack>6</Attack>
  <CriticalDamage chance="0.01">1</CriticalDamage>
  <Armor>5</Armor>
  <Overrunnable>true</Overrunnable>
  <Hitpoints>90</Hitpoints>
  <Effectiveness category="unitcategory_infantry">1</Effectiveness>
  <Effectiveness category="unitcategory_cavalry">1.5</Effectiveness>
  <Effectiveness category="unitcategory_artillery">0.75</Effectiveness>
  <Effectiveness category="unitcategory_siege">0.8</Effectiveness>    
  <Effectiveness category="unitcategory_special">1</Effectiveness>
  <RequirementGroup>
    <Requirement id="building_infantry_tower" min_level="1" />
  </RequirementGroup>
  <RequirementGroup>
    <Requirement id="building_barracks" min_level="5" />
  </RequirementGroup>
  <RequirementGroup>
      <Requirement id="building_barracks_2" min_level="1" />
  </RequirementGroup>
  
</Unit>
