<?xml version="1.0" encoding="UTF-8"?>
<!DOCTYPE Rules SYSTEM "../rules.dtd">

    <Unit id="thrower" category="unitcategory_artillery">
      <Name>Pebble Thrower</Name>
      <Name lang="de_DE">Kieselsteinwerfer</Name>
  <Flavour lang="en_US">
    <p>Kills opposing units.</p>
  </Flavour>
  <Flavour lang="de_DE">
    <p>Kämpft gegen andere Einheiten.</p>
  </Flavour>
      <Description lang="de_DE">
        <p>Große Steine, kleine Steine, ein Kieselsteinwerfer mag sie alle, solange er sie jemandem an den Kopf werfen kann. Ok, zugegeben, die kleinen mag er ein bisschen lieber. Nichtsdestotrotz kann er moderaten kritischen Schaden zufügen - denn, wie jeder weiß, das kann auch ins Auge gehen.</p> 
      </Description>
      <Description lang="en_US">
        <p>Small Stones, big Stones, a Peeble Thrower likes them all, as long as he can throw them at people. Ok, granted, the small ones are slightly prefered... Nevertheless, he may inflict moderate critical damage by sometimes hitting an opponent's eye.'</p>
      </Description>
      <Cost id="resource_stone" round="true">90</Cost>  
      <Cost id="resource_wood" round="true">45</Cost>
      <Cost id="resource_fur" round="true">67</Cost>    
      <ProductionTime shortenable="true">900</ProductionTime>  
      <Velocity>1</Velocity>
      <ActionPoints>4</ActionPoints>
      <Initiative>8</Initiative>
      <Attack>17</Attack>
      <CriticalDamage chance="0.02">5</CriticalDamage>
      <Armor>2</Armor>
      <Overrunnable>true</Overrunnable>
      <Hitpoints>60</Hitpoints>
      <Effectiveness category="unitcategory_infantry">1.2</Effectiveness>
      <Effectiveness category="unitcategory_cavalry">0.92</Effectiveness>
      <Effectiveness category="unitcategory_artillery">1</Effectiveness>
      <Effectiveness category="unitcategory_siege">0.8</Effectiveness>   
      <Effectiveness category="unitcategory_special">1</Effectiveness>                  
    </Unit>