<?xml version="1.0" encoding="UTF-8"?>
<!DOCTYPE Rules SYSTEM "../rules.dtd">

<Unit id="little_chief" category="unitcategory_special">
  <Name>Little Chief</Name>
  <Name lang="de_DE">Kleiner Häuptling</Name>
  
  <Description lang="de_DE">
    <p>Ein Kleiner Häuptling ist ungefähr so beliebt wie die Begegnung mit einem hungrigen Dinosaurier. Als integranter, karrieresüchtiger, aalglatter Möchtegern ist der Kleine Häuptling das Rollenvorbild für ganze Generationen an Wichtigtuern. Zum Glück kann der Kleine Häuptling unter dem Vorwand der Gründung einer Lagerstätte aus der Siedlung verbannt werden.</p>
  </Description>
  <Description lang="en_US">
    <p>Little Chiefs are in charge of expansions.</p>
  </Description>
  <Flavour lang="en_US">
    <p>Kills opposing units.</p>
  </Flavour>
  <Flavour lang="de_DE">
    <p>Ein Kleiner Häuptling darf im Namen des richtigen Häuptlings eine Lagerstätte gründen. Tatsächlich ist das nur die einfachste Möglichkeit ihn aus der Siedlung zu bekommen. Eine Neugründung wäre ein Bonus.</p>
  </Flavour>
  <Cost id="resource_stone" round="true">3000</Cost>  
  <Cost id="resource_wood" round="true">3000</Cost>    
  <Cost id="resource_fur" round="true">1500</Cost>    
  <ProductionTime shortenable="true">7200</ProductionTime>
  <Velocity>1</Velocity>
  <ActionPoints>4</ActionPoints>
  <Initiative>10</Initiative>
  <Attack>1</Attack>
  <CriticalDamage chance="0.01">0</CriticalDamage>
  <Armor>1</Armor>
  <Overrunnable>true</Overrunnable>
  <Hitpoints>100</Hitpoints>
  <Effectiveness category="unitcategory_infantry">0.1</Effectiveness>
  <Effectiveness category="unitcategory_cavalry">0.1</Effectiveness>
  <Effectiveness category="unitcategory_artillery">0.1</Effectiveness>
  <Effectiveness category="unitcategory_siege">0.1</Effectiveness>
  <Effectiveness category="unitcategory_special">1</Effectiveness>
  <Requirement id="building_campfire" min_level="10" />  
  <!-- add ability to found settlement here not in category -->    
  <CanCreate id="settlement_outpost" />
</Unit>
