<?xml version="1.0" encoding="UTF-8"?>
<!DOCTYPE Rules SYSTEM "../rules.dtd">


<Building id="building_artillery_tower" group="military" category="building_category_fortress_tower" buyable="true" destructable="true">  
  <Name lang="de_DE">Ballistisches Erprobungszentrum</Name>
  <Name lang="en_US">Ballistic R+D</Name>
  <Description lang="de_DE">
    <p>Schulungszentrum für alle Distanzkämpfer.</p>
  </Description>
  <Description lang="en_US">
    <p>Trains artillery.</p>
  </Description>
  <Requirement id="science_ballistics" min_level="1" />
  <Requirement id="building_fortress_fortification" min_level="1" />  
  <Cost id="resource_stone" round="true">LEVEL*100</Cost>  
  <Cost id="resource_wood" round="true">LEVEL*10</Cost>    
  <ProductionTime shortenable="true">2*(LEVEL+1)+10</ProductionTime>             
</Building>
