<?xml version="1.0" encoding="UTF-8"?>
<!DOCTYPE Rules SYSTEM "../rules.dtd">

    <Unit id="light_cavalry_4" category="unitcategory_cavalry">
      <Name>Ostrich Riders4</Name>
      <Name lang="de_DE">Dinoreiter</Name>
  <Flavour lang="en_US">
    <p>Kills opposing units.</p>
  </Flavour>
  <Flavour lang="de_DE">
    <p>Der Traum eines jeden neuen Reiters. Einen Dino reiten. Wenn man es endlich geschafft hat wünscht man sich doch lieber Fernkämpfer geworden zu sein. Ein Dino stinkt! Und die Dinowäsche nach einer Schlacht kann auch mal Tage dauern.</p>
  </Flavour>
      <Description lang="de_DE">
        <p>Als Reiter eines Dinos hat man genau zwei Aufgaben. Erstens nicht abgeworfen zu werden und zweitens den Dino immer wieder auf das Schlachtfeld zurückzulenken, wenn er erstmal durch die Schlachtreihen durchgeborchen ist. Mit Füßen, Schwanz und Zähnen werden die hilflosen Gegner niedergemäht.</p> 
        <p>Kein Wunder, gibt es zu Hause doch nichts zu fressen.</p> 
      </Description>
      <Description lang="en_US">
        <p>Ostrichs are not only delicious but also excellent and fast animals to be used in combats. Ostrich riders are very quick, but only lightly armored.</p>
      </Description>
      <Cost id="resource_stone" round="true">160</Cost>  
      <Cost id="resource_wood" round="true">140</Cost>    
      <Cost id="resource_fur" round="true">200</Cost>    
      <ProductionTime shortenable="true">950</ProductionTime>  
      <Velocity>1</Velocity>
      <ActionPoints>4</ActionPoints>
      <Initiative>26</Initiative>
      <Attack>10</Attack>
      <CriticalDamage chance="0.02">1</CriticalDamage>
      <Armor>6</Armor>
      <Overrunnable>true</Overrunnable>
      <Hitpoints>125</Hitpoints>
      <Effectiveness category="unitcategory_infantry">0.75</Effectiveness>
      <Effectiveness category="unitcategory_cavalry">1</Effectiveness>
      <Effectiveness category="unitcategory_artillery">1.5</Effectiveness>
      <Effectiveness category="unitcategory_siege">0.8</Effectiveness>   
      <Effectiveness category="unitcategory_special">1</Effectiveness>
      <RequirementGroup>
        <Requirement id="building_cavalry_tower" min_level="15" />
        <Requirement id="building_fortress_main" min_level="15" />
      </RequirementGroup>
      <RequirementGroup>
        <Requirement id="building_stud" min_level="20" />
        <Requirement id="building_copper_smelter" min_level="1" />
      </RequirementGroup>
    </Unit>
