<?xml version="1.0" encoding="UTF-8"?>
<!DOCTYPE Rules SYSTEM "../rules.dtd">

    <Unit id="skewer" category="infantry">
      <Name>Skewer</Name>
      <Name lang="de_DE">Bratspießträger</Name>
      <Description lang="de_DE">
        <p>Der Umgang mit der Waffe ist schnell gelernt: Das spitze Ende muss nach vorn!</p> 
      </Description>
      <Description lang="en_US">
        <p>Skewer Crew training 101: stick'em with the pointy end!</p>
      </Description>
      <Cost id="resource_stone" round="true">2</Cost>  
      <Cost id="resource_wood" round="true">10</Cost>    
      <Cost id="resource_fur" round="true">4</Cost>    
      <ProductionTime shortenable="true">300</ProductionTime>   
	  <Requirement id="building_firing_range" min_level="11" />	  
      <Velocity>1</Velocity>
      <ActionPoints>4</ActionPoints>
      <Initiative>15</Initiative>
      <Attack>14</Attack>
      <CriticalDamage chance="0.01" >6</CriticalDamage>
      <Armor>14</Armor>
      <Overrunnable>true</Overrunnable>
      <Hitpoints>90</Hitpoints>
      <Effectiveness category="infantry">0.6</Effectiveness><!-- due to the long weapon reduced effectivity against infantry but full effectivity against cavalry. a standard infantry (short weapon) would have effectivity 1 against infantry and reduced effictivity against cavalry, right?! -->
      <Effectiveness category="cavalry">1</Effectiveness>
      <Effectiveness category="artillery">1</Effectiveness>
      <Effectiveness category="siege">1</Effectiveness>     
    </Unit>