<?xml version="1.0" encoding="UTF-8"?>
<!DOCTYPE Rules SYSTEM "../rules.dtd">

    <Unit id="thrower_3" category="unitcategory_artillery">
      <Name>Pebble Thrower3</Name>
      <Name lang="de_DE">Steinschleuderer</Name>
      <Description lang="de_DE">
        <p>Mit der Schleuder können größere Steine weiter geworfen werden. So trifft der Steinschleuderer oft die unvorbereiteten Kämpfer in der zweiten Reihe wodurch insgesamt deutlich mehr Opfer zu beklagen bzw. zu bejubeln sind. Je nach der Seite des Kampfes auf der man gerade steht. Was durchaus nicht immer eindeutig ist.</p> 
      </Description>
      <Description lang="en_US">
        <p>You can throw bigger stones even further if you use a catapult. Stone throwers often hit unsuspecting warriors in the second row, leading to a much higher number of overall casualties that are either suffered or celebrated, depending on which side of the battle you happen to be. Which isn’t always obvious.</p>
      </Description>
      <Flavour lang="en_US">
        <p>Aiming is for sissies. The stone throwers‘ motto is: “The further you can throw the stone, the better!” Sometimes they’re right.</p>
      </Flavour>
      <Flavour lang="de_DE">
        <p>Zielen ist was für Anfänger. Das Motto der Steinschleuderer: 'Je weiterer der Stein geworfen wird, desto besser!' Stimmt sogar manchmal.</p>
      </Flavour>
      <Cost id="resource_stone" round="true">90</Cost>  
      <Cost id="resource_wood" round="true">90</Cost>
      <Cost id="resource_fur" round="true">140</Cost>    
      <ProductionTime shortenable="true">1050</ProductionTime>  
      <Velocity>1</Velocity>
      <ActionPoints>4</ActionPoints>
      <Initiative>8</Initiative>
      <Attack>10</Attack>
      <CriticalDamage chance="0.05">7</CriticalDamage>
      <Armor>3</Armor>
      <Overrunnable>true</Overrunnable>
      <Hitpoints>50</Hitpoints>
      <Effectiveness category="unitcategory_infantry">1.5</Effectiveness>
      <Effectiveness category="unitcategory_cavalry">0.75</Effectiveness>
      <Effectiveness category="unitcategory_artillery">0.75</Effectiveness>
      <Effectiveness category="unitcategory_siege">0.8</Effectiveness>  
      <Effectiveness category="unitcategory_special">1</Effectiveness>   
      <RequirementGroup>
        <Requirement id="building_artillery_tower" min_level="15" />
        <Requirement id="building_fortress_fortification" min_level="14" />
      </RequirementGroup>
      <RequirementGroup>
        <Requirement id="building_firing_range" min_level="15" />
      </RequirementGroup>
    </Unit>
