<?xml version="1.0" encoding="UTF-8"?>
<!DOCTYPE Rules SYSTEM "../rules.dtd">

    <Unit id="babysaurus" category="unitcategory_cavalry">
      <Name>Babysaurus</Name>
      <Name lang="de_DE">Babysaurus</Name>
      <Description lang="de_DE">
        <p>Die Babysaurier haben noch keine spitzen Zähne, man kann zwar besser auf ihnen reiten, aber der Reiter muss dafür selbst die Keule schwingen.</p> 
      </Description>
      <Description lang="en_US">
        <p>Babysaurus's teeth are not sharp. They are easy to ride but their rider has to kill his enemies himself.</p>
      </Description>
      <Cost id="resource_stone" round="true">50</Cost>  
      <Cost id="resource_wood" round="true">70</Cost>    
      <Cost id="resource_fur" round="true">35</Cost>    
      <ProductionTime shortenable="true">900</ProductionTime>  
	  <Requirement id="building_stud" min_level="1" />
	  <Velocity>1.5</Velocity>
      <ActionPoints>4</ActionPoints>
      <Initiative>26</Initiative>
      <Attack>17</Attack>
      <CriticalDamage chance="0.01">4</CriticalDamage>
      <Armor>13</Armor>
      <Overrunnable>true</Overrunnable>
      <Hitpoints>80</Hitpoints>
      <Effectiveness category="unitcategory_infantry">0.92</Effectiveness>
      <Effectiveness category="unitcategory_cavalry">1</Effectiveness>
      <Effectiveness category="unitcategory_artillery">1.2</Effectiveness>
      <Effectiveness category="unitcategory_siege">0.8</Effectiveness>   
    </Unit>