<?xml version="1.0" encoding="UTF-8"?>
<!DOCTYPE Rules SYSTEM "../rules.dtd">

    <Unit id="light_cavalry_2" category="unitcategory_cavalry">
      <Name>One-handed Ostrich Rider</Name>
      <Name lang="de_DE">Einhändiger Straußenreiter</Name>
      <Description lang="de_DE">
        <p>Eine handliche Keule in der freien Hand sind einhändige Straußenkrieger der Todfeind aller Fernkämpfer.</p>
        <p>Im Kampf gegen Keulenkrieger ziehen sie allerdings den Kürzeren, da sie nur eine kleine, nicht so schwere Keule bei sich führen.</p>
      </Description>
      <Description lang="en_US">
        <p>With a handy little club in his free hand, the one-handed ostrich rider is a deadly enemy for stone throwers. In battle against clubbers, though, they usually come off worse because they only have rather small, light clubs.</p>
      </Description>
      <Flavour lang="en_US">
        <p>Experienced ostrich riders only need one hand to hold on to their mounts, which means they have one hand free to do more practical things. Like picking their noses, for instance, or smashing in the skulls of their enemies.</p>
      </Flavour>
      <Flavour lang="de_DE">
        <p>Mit ausreichend Erfahrung braucht der Reiter nur noch eine Hand zum Festhalten und hat so die andere Hand für sinnvollere Tätigkeiten frei. Zum Beispiel um den Mädels zuzuwinken oder seinen Feinden den Schädel einzuhauen.</p>
      </Flavour>
      <Cost id="resource_stone" round="true">40</Cost>  
      <Cost id="resource_wood" round="true">35</Cost>    
      <Cost id="resource_fur" round="true">50</Cost>    
      <ProductionTime shortenable="true">800</ProductionTime>  
      <Velocity>1</Velocity>
      <ActionPoints>4</ActionPoints>
      <Initiative>26</Initiative>
      <Attack>7</Attack>
      <CriticalDamage chance="0.02">1</CriticalDamage>
      <Armor>5</Armor>
      <Overrunnable>true</Overrunnable>
      <Hitpoints>100</Hitpoints>
      <Effectiveness category="unitcategory_infantry">0.75</Effectiveness>
      <Effectiveness category="unitcategory_cavalry">1</Effectiveness>
      <Effectiveness category="unitcategory_artillery">1.5</Effectiveness>
      <Effectiveness category="unitcategory_siege">0.8</Effectiveness>   
      <Effectiveness category="unitcategory_special">1</Effectiveness>
      <RequirementGroup>
        <Requirement id="building_cavalry_tower" min_level="7" />
        <Requirement id="building_fortress_fortification" min_level="6" />  
      </RequirementGroup>
      <RequirementGroup>
        <Requirement id="building_stud" min_level="10" />  
      </RequirementGroup> 
    </Unit>
