<?xml version="1.0" encoding="UTF-8"?>
<!DOCTYPE Rules SYSTEM "../rules.dtd">

 <Unit id="tree_huggers" category="unitcategory_infantry">
      <Name>Tree Huggers</Name>
      <Name lang="de_DE">Baum-Brutalo</Name>
  <Flavour lang="en_US">
    <p>Kills opposing units.</p>
  </Flavour>
  <Flavour lang="de_DE">
    <p>Wozu den Baum zu einer Keule verarbeiten, wenn man einfach den ganzen Baum schwingen kann.</p>
  </Flavour>
      <Description lang="de_DE">
        <p>Groß, stark, sauber rasierter Bart. Ein Baum-Brutalo legt sehr großen Wert auf sein Äußeres.</p> 
	<p>In der Schlacht bietet der Baum-Brutalo ein seltsames Schauspiel. Umhüllt von den rauschen Blättern seines Kampfbaumes wirbelt der Baum-Brutalo durch die gegnerischen Reihen wie ein Säberlzahntiger, der sich den Schwanz geklammt hat. Nicht den flauschigen, den anderen...</p>
	<p> Kein Feind kann einen Baum-Brutalo erreichen, wenn er erst einmal in Fahrt gekommen ist. Da bleibt nur wegrennen und hoffen, dass ihm irgendwann die Puste ausgeht, oder er von Steinen und Speeren gespickt zu Boden geht.</p>
      </Description>
      <Description lang="en_US">
        <p>What Tree-Huggers lack in brains, they make up for with sheer strength.</p>
		<p>Telling by an unverified legend, those guys are brought up in a tree-nursery.</p>
      </Description>
      <Cost id="resource_stone" round="true">140</Cost>  
      <Cost id="resource_wood" round="true">180</Cost>    
      <Cost id="resource_fur" round="true">240</Cost>    
      <ProductionTime shortenable="true">900</ProductionTime>  
      <Velocity>1</Velocity>
      <ActionPoints>4</ActionPoints>
      <Initiative>16</Initiative>
      <Attack>7</Attack>
      <CriticalDamage chance="0.02">2</CriticalDamage>
      <Armor>9</Armor>
      <Overrunnable>true</Overrunnable>
      <Hitpoints>135</Hitpoints>
      <Effectiveness category="unitcategory_infantry">0.75</Effectiveness>
      <Effectiveness category="unitcategory_cavalry">1.5</Effectiveness>
      <Effectiveness category="unitcategory_artillery">1</Effectiveness>
      <Effectiveness category="unitcategory_siege">0.8</Effectiveness> 
      <Effectiveness category="unitcategory_special">1</Effectiveness>   
      <RequirementGroup>
        <Requirement id="building_infantry_tower" min_level="15" />
        <Requirement id="building_fortress_main" min_level="15" />
      </RequirementGroup>
      <RequirementGroup>
        <Requirement id="building_barracks" min_level="20" />
        <Requirement id="building_copper_smelter" min_level="1" />
      </RequirementGroup>
    </Unit>
