<?xml version="1.0" encoding="UTF-8"?>
<!DOCTYPE Rules SYSTEM "../rules.dtd">

    <Unit id="thrower_2" category="unitcategory_artillery">
      <Name>Pebble Thrower2</Name>
      <Name lang="de_DE"> Zielsicherer Kieselsteinwerfer</Name>
  <Flavour lang="en_US">
    <p>Kills opposing units.</p>
  </Flavour>
  <Flavour lang="de_DE">
    <p>Einen Stein auf fünfzig Meter Entfernung genau auf ein Ziel zu werfen, ist eine beeindruckende Leistung. Dummerweise stehen die Gegner meistens weiter weg.</p>
  </Flavour>
      <Description lang="de_DE">
        <p>Ein sicherer Wurf führt zu besseren Treffern. Nicht dass der Unterschied bemerkbar wäre, meist sind eh genug gegnerische Nahkämpfer da, aber es führt doch zu ein oder zwei kritischen Treffern.</p>
        <p>Ein bewegliches Ziel wie einen Straußenreiter zu treffen, ist eine große Leistung und der Unterschied zwischen Leben und Tod für einen Fernkämpfer.</p>
      </Description>
      <Description lang="en_US">
        <p>Small Stones, big Stones, a Peeble Thrower likes them all, as long as he can throw them at people. Ok, granted, the small ones are slightly prefered... Nevertheless, he may inflict moderate critical damage by sometimes hitting an opponent's eye.'</p>
      </Description>
      <Cost id="resource_stone" round="true">45</Cost>  
      <Cost id="resource_wood" round="true">45</Cost>
      <Cost id="resource_fur" round="true">60</Cost>    
      <ProductionTime shortenable="true">525</ProductionTime>  
      <Velocity>1</Velocity>
      <ActionPoints>4</ActionPoints>
      <Initiative>8</Initiative>
      <Attack>9</Attack>
      <CriticalDamage chance="0.05">6</CriticalDamage>
      <Armor>3</Armor>
      <Overrunnable>true</Overrunnable>
      <Hitpoints>50</Hitpoints>
      <Effectiveness category="unitcategory_infantry">1.5</Effectiveness>
      <Effectiveness category="unitcategory_cavalry">0.75</Effectiveness>
      <Effectiveness category="unitcategory_artillery">0.75</Effectiveness>
      <Effectiveness category="unitcategory_siege">0.8</Effectiveness>   
      <Effectiveness category="unitcategory_special">1</Effectiveness>   
      <RequirementGroup>
        <Requirement id="building_artillery_tower" min_level="5" />
        <Requirement id="building_fortress_main" min_level="5" />
      </RequirementGroup>
      <RequirementGroup>
        <Requirement id="building_firing_range" min_level="10" />
      </RequirementGroup>
    </Unit>
